Key,Value
headingmain,Care. For Families. By Families
headingtext,"Soon you don't have to let time, distance or money keep you from helping your aging parent."
headingabout,"Safe, Affordable and Full of Heart"
headingabouttext,"Help-Full connects you with the family and friends -near and far- to get and give help for a loved one. We provide assistance with the everyday tasks of <b>family caregiving, rides, meal preparations, house-keeping </b>and much more. Our vetted, trained ""Helpers"" are here to assist you with these tasks so you have more time for your family - and yourself."
givehelptext,Help other families and earn points for you future needs.
gethelptext,Take a load off your hands. Request helpers to assist you.
headingsq,Safety and Quality
headingsqtext,We at Help-Full have loved ones who need help too. So we've built a platform that is safe and dependable that we trust to use for our own loved ones.
